category,url,title,price,discount,description,age_rating,genres,developer,release_date,review_score
action,https://store.steampowered.com/app/730/CounterStrike_2/?snr=1_7_7_240_150_1,Counter-Strike 2,Бесплатные,0%,"Более двух десятилетий Counter-Strike служит примером первоклассной соревновательной игры, путь развития которой определяют миллионы игроков со всего мира. Теперь пришло время нового этапа — Counter-Strike 2.",Не указано,"Шутер от первого лица, Шутер, Для нескольких игроков, , ",Valve,21 авг. 2012 г.,81% положительных
action,https://store.steampowered.com/app/570/Dota_2/?snr=1_7_7_240_150_1,Dota 2,Бесплатно,0%,"Ежедневно миллионы игроков по всему миру сражаются от лица одного из более сотни героев Dota 2, и даже после тысячи часов в ней есть чему научиться. Благодаря регулярным обновлениям игра живёт своей жизнью: геймплей, возможности и герои постоянно преображаются.",Не указано,"Бесплатная игра, MOBA, Для нескольких игроков, , ",Valve,9 июл. 2013 г.,72% положительных
action,https://store.steampowered.com/app/1808500/ARC_Raiders/?snr=1_7_7_240_150_1,ARC Raiders,3220 руб.,0%,"ARC Raiders – анонсированная многопользовательская игра жанра extraction adventure, действие которой разворачивается в суровом будущем на Земле, атакованной загадочными механическими захватчиками ARC.",Не указано,"Шутер с эвакуацией, Игрок против игрока, , Игрок против ИИ, ",Embark Studios,30 окт. 2025 г.,87% положительных
action,https://store.steampowered.com/app/2592160/Dispatch/?snr=1_7_7_240_150_1,Dispatch,1100 руб.,0%,"""Dispatch"" — это комедия о рабочем месте супергероев, в которой ваш выбор имеет значение. Управляйте командой проблемных героев и решайте, кого отправить на экстренные вызовы по всему городу, одновременно балансируя офисную политику, личные отношения и собственный путь к становлению героем.",Не указано,"Решения с последствиями, Глубокий сюжет, Нагота, , ",AdHoc Studio,22 окт. 2025 г.,96% положительных
action,https://store.steampowered.com/app/578080/PUBG_BATTLEGROUNDS/?snr=1_7_7_240_150_1,PUBG: BATTLEGROUNDS,Бесплатные,0%,"PUBG: BATTLEGROUNDS — культовый шутер, пробудивший интерес к жанру «королевская битва», теперь бесплатный! Высаживайтесь на разные карты, добывайте уникальное оружие и припасы и постарайтесь выжить в постоянно сужающейся зоне, где опасность подстерегает вас за каждым углом.",Не указано,"Выживание, Шутер, Королевская битва, , ",PUBG Corporation,21 дек. 2017 г.,69% положительных
action,https://store.steampowered.com/app/252490/Rust/?snr=1_7_7_240_150_1,Rust,1399 руб.,0%,"Единственная цель в Rust — выживание. Дикая природа острова, его обитатели, окружение, другие выжившие — всё вокруг хочет твоей смерти. Делай всё, что в твоих силах, чтобы пережить ещё одну ночь.",Не указано,"Выживание, Крафтинг, Для нескольких игроков, , ",Facepunch Studios,8 фев. 2018 г.,84% положительных
action,https://store.steampowered.com/app/3527290/PEAK/?snr=1_7_7_240_150_1,PEAK,222 руб.,-38%,"PEAK — это совместная игра о восхождении, где малейшая ошибка может привести к гибели. Играйте в одиночку или вместе с группой отчаянных бойскаутов. Сбегите с таинственного острова, для чего вам потребуется забраться на гору в его центре. Хватит ли вам сил, чтобы достичь ПИКА?",Не указано,"Для нескольких игроков, Сетевой кооператив, Кооператив, , ",Team PEAK,16 июн. 2025 г.,91% положительных
action,https://store.steampowered.com/app/1903340/Clair_Obscur_Expedition_33/?snr=1_7_7_240_150_1,Clair Obscur: Expedition 33,3499 руб.,-20%,"Возглавьте Экспедицию 33 и уничтожьте Художницу, чтобы она никогда больше не смогла нарисовать смерть. Исследуйте мир чудес, созданный на основе Прекрасной эпохи Франции, и побеждайте уникальных врагов в пошаговой ролевой игре с механикой реального времени.",Не указано,"Пошаговые сражения, Глубокий сюжет, Фэнтези, , ",Sandfall Interactive,24 апр. 2025 г.,94% положительных
action,https://store.steampowered.com/app/3167020/Escape_from_Duckov/?snr=1_7_7_240_150_1,Escape from Duckov 逃离鸭科夫,689 руб.,0%,"Побег из Дакова — это PVE шутер с элементами сбора ресурсов - в мире уток! Собирай ресурсы, строй своё убежище и улучшай снаряжение в мире Дакова. Начни с нуля и добейся вершины. Перехитри враждебных уток, выживи или хотя бы выберись живым.",Не указано,"Приключение, Экшен, Шутер с эвакуацией, , Лутер-шутер",Team Soda,16 окт. 2025 г.,95% положительных
action,https://store.steampowered.com/app/3405340/Megabonk/?snr=1_7_7_240_150_1,Megabonk,429 руб.,-15%,"Разноси бесконечные волны врагов и становись абсурдно сильным! Собирай loot, level-апай, открывай characters и upgrade-ь всё, чтобы собирать уникальные и безумные билды, отражая орды тварей!",Не указано,"Рогалик, Экшен-рогалик, Упрощённый рогалик, , Инди",vedinad,18 сен. 2025 г.,92% положительных
action,https://store.steampowered.com/app/2827200/MIMESIS/?snr=1_7_7_240_150_1,MIMESIS,385 руб.,0%,"Кооперативный хоррор на выживание. Когда идёт проклятый дождь, появляются «Мимесис (Mimesis)», идеально копирующие ваших товарищей, создавая напряжение, какого вы ещё не испытывали.",Не указано,"Ранний доступ, Сетевой кооператив, Хоррор, Смешная, ","ReLU Games, Inc.",27 окт. 2025 г.,77% положительных
action,https://store.steampowered.com/app/2694490/Path_of_Exile_2/?snr=1_7_7_240_150_1,Path of Exile 2,1398 руб.,0%,"Path of Exile 2 – это бесплатная Action RPG следующего поколения от Grinding Gear Games, с совместным режимом до шести игроков. Спустя годы после событий оригинальной Path of Exile, вы возвратитесь в мрачный мир Рэкласта и будете искать способ положить конец разрастающейся порче.",Не указано,"Ролевой экшен, Слэшер, Ролевая игра, MMORPG, ",Grinding Gear Games,6 дек. 2024 г.,79% положительных
action,https://store.steampowered.com/app/238960/Path_of_Exile/?snr=1_7_7_240_150_1,Path of Exile,Бесплатные,0%,"Вы - изгнанник, который пытается выжить в мрачном мире Рэкласта. Сражаясь за свою жизнь, вы накопите силу, которая поможет вам отомстить тем, кто обрёк вас на эту участь. Path of Exile - это онлайн Action RPG в тёмном фэнтэзийном мире. Игра полностью бесплатна и не имеет Pay-to-Win элементов.",Не указано,"Бесплатная игра, Тёмное фэнтези, Ролевой экшен, , Лут",Grinding Gear Games,23 окт. 2013 г.,86% положительных
action,https://store.steampowered.com/app/1030300/Hollow_Knight_Silksong/?snr=1_7_7_240_150_1,Hollow Knight: Silksong,710 руб.,0%,"Исследуйте огромное проклятое царство в Hollow Knight: Silksong! Открывайте его тайны, сражайтесь и боритесь за свою жизнь, поднимаясь к вершинам земель, где правят шёлк и песня.",Не указано,"Метроидвания, Сложная, Инди, Похожа на Dark Souls, ",Team Cherry,4 сен. 2025 г.,91% положительных
action,https://store.steampowered.com/app/2399830/ARK_Survival_Ascended/?snr=1_7_7_240_150_1,ARK: Survival Ascended,2110 руб.,-50%,"Арк переосмысливается с основания в этой технологии видеоигр с помощью Unreal Engine 5! Сформируйте племя, приручите и породу сотни уникальных динозавров и первобытных существ, исследуйте, создайте, строите, строите и пробитесь на вершину пищевой цепи. Ваш новый мир ждет!",Не указано,"Ранний доступ, Выживание, Открытый мир, , Динозавры",Studio Wildcard,26 окт. 2023 г.,65% положительных
action,https://store.steampowered.com/app/1203620/Enshrouded/?snr=1_7_7_240_150_1,Enshrouded,319 руб.,-20%,"Вы пламярожденный герой – последний уголек надежды для гибнущей расы. Пробудитесь от сна, одолейте ужасы тлетворного тумана и верните родине былую красоту. В этом ролевом экшене вам и другим игрокам (максимум 16) предстоит сообща исследовать мир, сражаться с суровыми боссами и строить огромные залы.",Не указано,"Открытый мир, Выживание, Строительство базы, , ",Keen Games GmbH,24 янв. 2024 г.,82% положительных
action,https://store.steampowered.com/app/1245620/ELDEN_RING/?snr=1_7_7_240_150_1,ELDEN RING,3599 руб.,0%,"НОВЫЙ ФЭНТЕЗИЙНЫЙ РОЛЕВОЙ БОЕВИК. Восстань, погасшая душа! Междуземье ждёт своего повелителя. Пусть благодать приведёт тебя к Кольцу Элден.",Не указано,"Похожа на Dark Souls, Открытый мир, Тёмное фэнтези, , ","FromSoftware, Inc.",25 фев. 2022 г.,93% положительных
action,https://store.steampowered.com/app/236390/War_Thunder/?snr=1_7_7_240_150_1,War Thunder,Бесплатные,0%,"War Thunder – самая масштабная бесплатная кроссплатформенная многопользовательская онлайн-игра, посвященная боевой технике самых разных войн и конфликтов – с начала XX века и до наших дней. Авиация, наземные силы и флот сражаются вместе в одном бою.",Не указано,"Бесплатная игра, Симулятор, Гонки на выживание, Бой, ",Gaijin Entertainment,15 авг. 2013 г.,75% положительных
action,https://store.steampowered.com/app/2183900/Warhammer_40000_Space_Marine_2/?snr=1_7_7_240_150_1,"Warhammer 40,000: Space Marine 2",3199 руб.,0%,"Обретите сверхчеловеческую мощь космодесантника. Пустите в ход смертоносные навыки и разрушительное оружие, чтобы истребить безжалостных тиранидов. Защитите Империум в ярких одиночных боях или многопользовательских режимах с видом от третьего лица.",Не указано,"Warhammer 40K, Экшен, Кооператив, , ",Saber Interactive,9 сен. 2024 г.,83% положительных
action,https://store.steampowered.com/app/284160/BeamNGdrive/?snr=1_7_7_240_150_1,BeamNG.drive,880 руб.,0%,"Основанный на физике мягких объектов автомобильный симулятор, способный практически на всё.",Не указано,"Симулятор, Вождение, Физика, Реализм, Разрушения",BeamNG,29 мая. 2015 г.,96% положительных
action,https://store.steampowered.com/app/739630/Phasmophobia/?snr=1_7_7_240_150_1,Phasmophobia,710 руб.,0%,Phasmophobia is a 4 player online co-op psychological horror. Paranormal activity is on the rise and it’s up to you and your team to use all the ghost-hunting equipment at your disposal in order to gather as much evidence as you can.,Не указано,"Хоррор, Сетевой кооператив, Для нескольких игроков, , ",Kinetic Games,18 сен. 2020 г.,91% положительных
action,https://store.steampowered.com/app/440/Team_Fortress_2/?snr=1_7_7_240_150_1,Team Fortress 2,Бесплатные,0%,"Девять классов с уникальными характерами откроют вам доступ ко множеству разнообразных тактик и навыков. Игра беспрестанно пополняется новыми режимами, картами, предметами и, самое главное, шляпами!",Не указано,"Бесплатная игра, Геройский шутер, Для нескольких игроков, , ",Valve,10 окт. 2007 г.,93% положительных
action,https://store.steampowered.com/app/2074920/The_First_Descendant/?snr=1_7_7_240_150_1,The First Descendant,Бесплатно,0%,The First Descendant is a third-person looter shooter powered by Unreal Engine 5. Become a Descendant. Fight for the survival of humanity. Descendants have unique abilities to tackle both solo and co-op missions. Up to 4 players use varied mechanics to defeat giant bosses. BE THE FIRST DESCENDANT!,Не указано,"Бесплатная игра, Сексуальный контент, Лутер-шутер, , ","NEXON Games Co., Ltd.",30 июн. 2024 г.,61% положительных
action,https://store.steampowered.com/app/1326470/Sons_Of_The_Forest/?snr=1_7_7_240_150_1,Sons Of The Forest,1100 руб.,0%,"Sent to find a missing billionaire on a remote island, you find yourself in a cannibal-infested hellscape. Craft, build, and struggle to survive, alone or with friends, in this terrifying new open-world survival horror simulator.",Не указано,"Выживание, Открытый мир, Для нескольких игроков, , ",Endnight Games Ltd,22 фев. 2024 г.,90% положительных
action,https://store.steampowered.com/app/1159690/Voidtrain/?snr=1_7_7_240_150_1,Voidtrain,424 руб.,-35%,"Станьте членом экипажа Межпространственного Экспресса! Откройте для себя мир, полный загадочных существ и локаций. Улучшайте и кастомизируйте свой поезд, собирайте новые материалы и создавайте новое оружие. Играйте в одиночку или онлайн до 4 человек.",Не указано,"Симулятор выживания и крафтинга в открытом мире, Кооператив, , , ",HypeTrain Digital,7 ноя. 2025 г.,71% положительных
strategy,https://store.steampowered.com/app/570/Dota_2/?snr=1_7_7_240_150_1,Dota 2,Бесплатно,0%,"Ежедневно миллионы игроков по всему миру сражаются от лица одного из более сотни героев Dota 2, и даже после тысячи часов в ней есть чему научиться. Благодаря регулярным обновлениям игра живёт своей жизнью: геймплей, возможности и герои постоянно преображаются.",Не указано,"Бесплатная игра, MOBA, Для нескольких игроков, , ",Valve,9 июл. 2013 г.,72% положительных
strategy,https://store.steampowered.com/app/730/CounterStrike_2/?snr=1_7_7_240_150_1,Counter-Strike 2,Бесплатные,0%,"Более двух десятилетий Counter-Strike служит примером первоклассной соревновательной игры, путь развития которой определяют миллионы игроков со всего мира. Теперь пришло время нового этапа — Counter-Strike 2.",Не указано,"Шутер от первого лица, Шутер, Для нескольких игроков, , ",Valve,21 авг. 2012 г.,81% положительных
strategy,https://store.steampowered.com/app/2592160/Dispatch/?snr=1_7_7_240_150_1,Dispatch,1100 руб.,0%,"""Dispatch"" — это комедия о рабочем месте супергероев, в которой ваш выбор имеет значение. Управляйте командой проблемных героев и решайте, кого отправить на экстренные вызовы по всему городу, одновременно балансируя офисную политику, личные отношения и собственный путь к становлению героем.",Не указано,"Решения с последствиями, Глубокий сюжет, Нагота, , ",AdHoc Studio,22 окт. 2025 г.,96% положительных
strategy,https://store.steampowered.com/app/578080/PUBG_BATTLEGROUNDS/?snr=1_7_7_240_150_1,PUBG: BATTLEGROUNDS,Бесплатные,0%,"PUBG: BATTLEGROUNDS — культовый шутер, пробудивший интерес к жанру «королевская битва», теперь бесплатный! Высаживайтесь на разные карты, добывайте уникальное оружие и припасы и постарайтесь выжить в постоянно сужающейся зоне, где опасность подстерегает вас за каждым углом.",Не указано,"Выживание, Шутер, Королевская битва, , ",PUBG Corporation,21 дек. 2017 г.,69% положительных
strategy,https://store.steampowered.com/app/3450310/Europa_Universalis_V/?snr=1_7_7_240_150_1,Europa Universalis V,3319 руб.,0%,"Используйте войну, торговлю или дипломатию, чтобы претворить свои самые смелые амбиции и доминировать на протяжении пяти веков истории в новейшей версии Europa Universalis — флагманской исторической игры Paradox Interactive в жанре глобальной стратегии.",Не указано,"Управление ресурсами, Глобальная стратегия, 4X, , ",Paradox Tinto,4 ноя. 2025 г.,70% положительных
strategy,https://store.steampowered.com/app/1086940/Baldurs_Gate_3/?snr=1_7_7_240_150_1,Baldur's Gate 3,1999 руб.,0%,"Соберите отряд и вернитесь в Забытые Королевства. Вас ждет история о дружбе и предательстве, выживании и самопожертвовании, о сладком зове абсолютной власти.",Не указано,"Ролевая игра, Кастомизация персонажа, , Глубокий сюжет, ",Larian Studios,3 авг. 2023 г.,95% положительных
strategy,https://store.steampowered.com/app/1669000/Age_of_Wonders_4/?snr=1_7_7_240_150_1,Age of Wonders 4,2769 руб.,0%,Правьте волшебным королевством в Age of Wonders 4! Вас ждёт фирменное сочетание 4X-стратегии с пошаговыми тактическими сражениями.,Не указано,"Стратегия, Ролевая игра, 4X, Кастомизация персонажа, ",Triumph Studios,2 мая. 2023 г.,79% положительных
strategy,https://store.steampowered.com/app/1158310/Crusader_Kings_III/?snr=1_7_7_240_150_1,Crusader Kings III,2769 руб.,0%,"Любовь, война, интриги и величие. Определите наследие своего знатного рода в безграничной глобальной стратегии Crusader Kings III. Смерть — это только начало вашего пути по истории выбранной династии в этой полной неожиданностей и славы симуляции Средних веков.",Не указано,"Стратегия, Средневековье, Глобальная стратегия, , ",Paradox Development Studio,1 сен. 2020 г.,80% положительных
strategy,https://store.steampowered.com/app/1527950/Wartales/?snr=1_7_7_240_150_1,Wartales,480 руб.,-63%,"Wartales — ролевая игра с открытым миром, в которой вам предстоит вести отряд наемников к богатству в огромной средневековой вселенной. Исследуйте мир, нанимайте спутников, получайте награды и раскрывайте тайны гробниц древних!",Не указано,"Ролевая игра, Открытый мир, Пошаговая стратегия, , ",Shiro Games,12 апр. 2023 г.,78% положительных
strategy,https://store.steampowered.com/app/294100/RimWorld/?snr=1_7_7_240_150_1,RimWorld,1099 руб.,0%,"Научно-фантастический симулятор колонии с интеллектуальным AI-рассказчиком. Создаёт истории, моделируя психологию, экологию, стрельбу, ближний бой, климат, биомы, дипломатию, межличностные отношения, искусство, медицину, торговлю и многое другое.",Не указано,"Симулятор колонии, Строительство базы, Выживание, , ",Ludeon Studios,17 окт. 2018 г.,96% положительных
strategy,https://store.steampowered.com/app/427520/Factorio/?snr=1_7_7_240_150_1,Factorio,Factorio Demo,0%,"Factorio - это игра о создании автоматизированных фабрик по производству вещей все более возрастающей сложности, в пределах бесконечного 2D мира - Используйте свое воображение для проектирования фабрик, комбинируйте простые элементы в комплексные структуры и, наконец, защищайтесь от враждебных существ.",Не указано,"Автоматизация, Строительство базы, , Песочница, ",Wube Software LTD.,14 авг. 2020 г.,97% положительных
