category,url,title,price,discount,description,age_rating,genres,developer,release_date,review_score
strategy,https://store.steampowered.com/app/1874880/Arma_Reforger/?snr=1_7_7_240_150_1,Arma Reforger,2690 руб.,0%,"Участвуйте в масштабных общевойсковых сражениях, создавайте миссии и управляйте ими в реальном времени, а также опробуйте неисчислимые модификации сообщества. Погрузитесь в эпоху холодной войны и испытайте самую реалистичную военную песочницу.",Не указано,"Военные действия, Симулятор, Шутер, Реализм, ",Bohemia Interactive,16 ноя. 2023 г.,69% положительных
strategy,https://store.steampowered.com/app/394360/Hearts_of_Iron_IV/?snr=1_7_7_240_150_1,Hearts of Iron IV,2769 руб.,0%,"Victory is at your fingertips! Your ability to lead your nation is your supreme weapon, the strategy game Hearts of Iron IV lets you take command of any nation in World War II; the most engaging conflict in world history.",Не указано,"Стратегия, Вторая мировая война, Глобальная стратегия, , ",Paradox Development Studio,6 июн. 2016 г.,87% положительных
strategy,https://store.steampowered.com/app/400750/Call_to_Arms__Gates_of_Hell_Ostfront/?snr=1_7_7_240_150_1,Call to Arms - Gates of Hell: Ostfront,300 руб.,-75%,"Call to Arms - Gates of Hell - реалистическая историческая стратегия про ВМВ. Примите на себя командование всех видов войск в одиночной и динамической кампании, кооперативе и мультиплеере - реиграбельность не имеет границ. Вы готовы погрузиться в пучину войны?",Не указано,"Вторая мировая война, Историческая, , Стратегия, ",Barbedwire Studios,11 июн. 2021 г.,83% положительных
strategy,https://store.steampowered.com/app/582660/Black_Desert/?snr=1_7_7_240_150_1,Black Desert,350 руб.,0%,"Played by over 20 million Adventurers - Black Desert Online is an open-world, action MMORPG. Experience intense, action-packed combat, battle massive world bosses, fight alongside friends to siege and conquer castles, and train in professions such as fishing, trading, crafting, cooking, and more!",Не указано,"Песочница, Ролевой экшен, Исследования, MMORPG, ",Pearl Abyss,26 июл. 2019 г.,70% положительных
strategy,https://store.steampowered.com/app/949230/Cities_Skylines_II/?snr=1_7_7_240_150_1,Cities: Skylines II,4979 руб.,-20%,Выстройте с нуля процветающий мегаполис в реалистичном симуляторе с живой экономикой и невероятно глубокой проработкой мира.,Не указано,"Градостроение, Симулятор, Строительство, Песочница, ",Colossal Order Ltd.,24 окт. 2023 г.,54% положительных
strategy,https://store.steampowered.com/app/3215050/Surviving_Mars_Relaunched/?snr=1_7_7_240_150_1,Surviving Mars: Relaunched,2199 руб.,0%,Фантастический строительный симулятор в новом обличье. Вам снова предстоит колонизировать Марс и выжить. Готовы? Марс ждет!,Не указано,"Симулятор, Стратегия, Симулятор колонии, , ",Haemimont Games,10 ноя. 2025 г.,69% положительных
strategy,https://store.steampowered.com/app/2870920/Restaurats/?snr=1_7_7_240_150_1,Restaurats,402 руб.,-25%,"Возглавь средневековый ресторан в команде с такими же крысами, как и ты! Готовьте еду, бросайте её в гостей, вытирайте напитки из-под скелетов! Стань легендарной поварской крысой, доказав оркам и вампирам, что самое вкусное мясо с кровью подают в вашем ресторане!",Не указано,"Кооператив, Кулинария, Для нескольких игроков, , ",toR Studio,7 ноя. 2025 г.,90% положительных
strategy,https://store.steampowered.com/app/648800/Raft/?snr=1_7_7_240_150_1,Raft,419 руб.,0%,"Raft™ throws you and your friends into an epic oceanic adventure! Alone or together, players battle to survive a perilous voyage across a vast sea! Gather debris, scavenge reefs and build your own floating home, but be wary of the man-eating sharks!",Не указано,"Выживание, Для нескольких игроков, , Кооператив, ",Redbeet Interactive,20 июн. 2022 г.,89% положительных
strategy,https://store.steampowered.com/app/2489330/Whiskerwood/?snr=1_7_7_240_150_1,Whiskerwood,799 руб.,-20%,"В этой градостроительной стратегии вам предстоит наладить жизнь трудолюбивых мышей под пятой, вернее, лапой пушистых сюзеренов. Вас ждет комплексное моделирование, сложные производственные цепочки и старая как мир грызня между кошками и мышами.",Не указано,"Стратегия, Симулятор, Строительство базы, , ",Minakata Dynamics,6 ноя. 2025 г.,91% положительных
strategy,https://store.steampowered.com/app/393380/Squad/?snr=1_7_7_240_150_1,Squad,1799 руб.,0%,"Squad — это тактический FPS, предлагающий аутентичный боевый опыт: реалистичные сражения, командная работа и коммуникация. Squad объединяет элементы аркадных шутеров и военого реализма в битвах на 100 игроков с участием техники и строительством укреплений.",Не указано,"Военные действия, Реализм, Шутер от первого лица, , ",Offworld,23 сен. 2020 г.,65% положительных
strategy,https://store.steampowered.com/app/436780/Tavern_Keeper/?snr=1_7_7_240_150_1,Tavern Keeper 🍻,"1015,20 руб.",-20%,"Встречайте Tavern Keeper 🍻 от создателей Game Dev Tycoon, уютно-хаотичный симулятор управления трактиром с мощной песочницей для дизайна и волшебной ролевой составляющей!",Не указано,"Ранний доступ, Симулятор, Менеджмент, Смешная, ",Greenheart Games 💚,3 ноя. 2025 г.,95% положительных
strategy,https://store.steampowered.com/app/526870/Satisfactory/?snr=1_7_7_240_150_1,Satisfactory,1300 руб.,0%,"Satisfactory — это игра от первого лица в открытом мире, вы которой вам нужно строить заводы, с упором на исследования и бои. Играйте в одиночестве или с друзьями, исследуйте незнакомую планету, возводите многоэтажные заводы и вступите в конвейерный рай!",Не указано,"Строительство базы, Автоматизация, Открытый мир, , ",Coffee Stain Studios,10 сен. 2024 г.,96% положительных
strategy,https://store.steampowered.com/app/761890/Albion_Online/?snr=1_7_7_240_150_1,Albion Online,Бесплатные,0%,"Albion Online - это MMORPG-песочница в фэнтезийном сеттинге, где присутствует управляемая игроками экономика, боевая система без привязки к классам и постоянные PvP-сражения.",Не указано,"MMORPG, Бесплатная игра, Открытый мир, ММО, ",Sandbox Interactive GmbH,17 июл. 2017 г.,72% положительных
strategy,https://store.steampowered.com/app/107410/Arma_3/?snr=1_7_7_240_150_1,Arma 3,2190 руб.,0%,"Испытайте вкус боевых действий в массовой военной игре. C более чем 20 видами техники и 40 видами оружия, различными режимами игры и безграничными возможностями создания контента, вы получаете наилучший реализм и разнообразие в Arma 3.",Не указано,"Военные действия, Экшен, Для нескольких игроков, , ",Bohemia Interactive,12 сен. 2013 г.,88% положительных
